{
  "artifact_family": "chunk_bus",
  "artifact_kind": "chunk_set",
  "schema_version": 1,
  "run_id": "governed-smoke-fixture",
  "producer": "fixture.source-owner",
  "entrypoint": "fixture_governed_producer",
  "source_items": ["sanitized-governed-fixture"],
  "chunks": [
    {
      "chunk_id": "fixture-governed-smoke-chunk-1",
      "chunk_index": 0,
      "char_len": 54,
      "document_id": "fixture-governed-document",
      "source_file": "sanitized-governed-fixture",
      "header_path": ["governed smoke"],
      "text": "Provider-owned canonical unit for Knowledge Inspect smoke.",
      "metadata": {
        "fixture": true,
        "source_authority": "fixture.source-owner"
      }
    }
  ],
  "chunk_count": 1
}
